{
  "schemaVersion": "1.0.0",
  "org": "ELDÆON",
  "orgSlug": "eldaeon",
  "generatedAt": "2026-06-24",
  "sensors": [
    {
      "id": "dionysus-infrasonic-mic",
      "name": "Infrasonic Microphone",
      "modality": "audio",
      "manufacturerModel": "Barometric differential-pressure sensor",
      "timing": {
        "timeSource": "gps_disciplined",
        "timeUncertaintyNs": null
      },
      "rawData": {
        "format": "NDJSON.gz",
        "locatorPattern": "{compute-id}/infrasonic/YYYY/MM/DD/",
        "sampleRateHz": null,
        "bitDepth": 16
      },
      "measurements": [
        {
          "name": "differential_pressure",
          "unit": "Pa",
          "uncertainty": {
            "u_c": null,
            "U": null,
            "k": 2,
            "type": "B"
          }
        }
      ],
      "calibration": {
        "calibrated": null,
        "currentMethod": null,
        "traceableReference": "CTBTO IMS infrasound network / EarthScope (IRIS) DMC infrasound data",
        "referenceInUse": false,
        "cadence": null,
        "uncertaintyBudget": null,
        "status": "candidate_identified",
        "notes": null
      },
      "specs": {
        "band": "<20 Hz infrasonic",
        "range_pa": "125-15000",
        "resolution_bits": 16,
        "interface": "I2C/SPI",
        "accuracy": "±0.25-1.5% of reading"
      },
      "specSource": "ELDÆON Dionysus spec sheet p2",
      "compute": "platform-pi-5",
      "recordsMapping": {
        "sensorType": "infrasonic_sensor",
        "detectionMethod": "acoustic"
      }
    },
    {
      "id": "dionysus-ultrasonic-mic",
      "name": "Ultrasonic Microphone",
      "modality": "audio",
      "manufacturerModel": "AudioMoth (MEMS)",
      "timing": {
        "timeSource": "gps_disciplined",
        "timeUncertaintyNs": null
      },
      "rawData": {
        "format": "WAV (raw) + NDJSON.gz (summary)",
        "locatorPattern": "{compute-id}/ultrasonic/YYYY/MM/DD/",
        "sampleRateHz": 384000,
        "bitDepth": 16
      },
      "measurements": [
        {
          "name": "sound_pressure_level",
          "unit": "dB",
          "uncertainty": {
            "u_c": null,
            "U": null,
            "k": 2,
            "type": "B"
          }
        },
        {
          "name": "peak_frequency",
          "unit": "Hz",
          "uncertainty": {
            "u_c": null,
            "U": null,
            "k": 2,
            "type": "A"
          }
        }
      ],
      "calibration": {
        "calibrated": null,
        "currentMethod": null,
        "traceableReference": "reference tone generator",
        "referenceInUse": null,
        "cadence": null,
        "uncertaintyBudget": null,
        "status": "candidate_identified",
        "notes": "reference method needs fuller definition (source, level, frequency points)"
      },
      "specs": {
        "frequency_response": "10 Hz - 192 kHz",
        "sample_rate_hz": 384000,
        "resolution_bits": 16,
        "snr_dba": 65,
        "interface": "USB 2.0",
        "supports_external_mic": true
      },
      "specSource": "ELDÆON Dionysus spec sheet p2",
      "compute": "platform-pi-5",
      "recordsMapping": {
        "sensorType": "ultrasonic_sensor",
        "detectionMethod": "acoustic"
      }
    },
    {
      "id": "dionysus-uv-camera",
      "name": "UV (Ultraviolet) Camera",
      "modality": "electro_optical",
      "manufacturerModel": "UVC CMOS module",
      "timing": {
        "timeSource": "gps_disciplined",
        "timeUncertaintyNs": null
      },
      "rawData": {
        "format": "MJPEG",
        "locatorPattern": null,
        "sampleRateHz": null,
        "bitDepth": 8
      },
      "measurements": [
        {
          "name": "scene_radiance_uv",
          "unit": "DN",
          "uncertainty": {
            "u_c": null,
            "U": null,
            "k": 2,
            "type": "B"
          }
        }
      ],
      "calibration": {
        "calibrated": null,
        "currentMethod": "response verification against a 395 nm UV light source",
        "traceableReference": "395 nm UV LED source",
        "referenceInUse": true,
        "cadence": null,
        "uncertaintyBudget": null,
        "status": "in_practice",
        "notes": null
      },
      "specs": {
        "resolution_modes": [
          "1920x1080@30",
          "1280x720@60",
          "640x480@120"
        ],
        "codec": "MJPEG",
        "pixel_um": 3,
        "spectral_band_nm": "~300-400 (UV)",
        "sensitivity_lux": 0.05,
        "interface": "USB 2.0 UVC"
      },
      "specSource": "ELDÆON Dionysus spec sheet p2",
      "compute": "platform-pi",
      "recordsMapping": {
        "sensorType": "eo_sensor",
        "detectionMethod": "electro_optical"
      }
    },
    {
      "id": "dionysus-ptz-camera",
      "name": "PTZ (Pan-Tilt-Zoom) Camera",
      "modality": "electro_optical",
      "manufacturerModel": "1/2.8\" STARVIS CMOS, 32x optical zoom",
      "timing": {
        "timeSource": "gps_disciplined",
        "timeUncertaintyNs": null
      },
      "rawData": {
        "format": "MJPEG/H.264",
        "locatorPattern": null,
        "sampleRateHz": null,
        "bitDepth": 8
      },
      "measurements": [
        {
          "name": "scene_radiance_visible",
          "unit": "DN",
          "uncertainty": {
            "u_c": null,
            "U": null,
            "k": 2,
            "type": "B"
          }
        }
      ],
      "calibration": {
        "calibrated": null,
        "currentMethod": "oriented to true north at install; pan/tilt zeroed (0,0) = north-facing forward axis; factory intrinsic calibration otherwise",
        "traceableReference": null,
        "referenceInUse": null,
        "cadence": "once (at install)",
        "uncertaintyBudget": null,
        "status": "in_practice",
        "notes": "EO/IR radiometric/geometric reference still to be determined"
      },
      "specs": {
        "resolution": "2560x1440@30 (4MP)",
        "sensor": "1/2.8\" STARVIS CMOS",
        "optical_zoom": "32x (4.6-154mm)",
        "low_light_lux": "0.005 color / 0.0005 b/w",
        "wdr_db": 120,
        "ingress_rating": "IP67/IK10",
        "temp_range_c": "-40 to 60",
        "power": "PoE+"
      },
      "specSource": "ELDÆON Dionysus spec sheet p2",
      "compute": "platform-pc",
      "recordsMapping": {
        "sensorType": "eo_sensor",
        "detectionMethod": "electro_optical"
      }
    },
    {
      "id": "dionysus-all-sky-camera",
      "name": "All Sky Camera",
      "modality": "electro_optical",
      "manufacturerModel": "1/1.7\" CMOS fisheye",
      "timing": {
        "timeSource": "gps_disciplined",
        "timeUncertaintyNs": null
      },
      "rawData": {
        "format": "MJPEG",
        "locatorPattern": null,
        "sampleRateHz": null,
        "bitDepth": 8
      },
      "measurements": [
        {
          "name": "scene_radiance_allsky",
          "unit": "DN",
          "uncertainty": {
            "u_c": null,
            "U": null,
            "k": 2,
            "type": "B"
          }
        }
      ],
      "calibration": {
        "calibrated": null,
        "currentMethod": "physically oriented at install so image top points true north; factory calibration otherwise",
        "traceableReference": null,
        "referenceInUse": null,
        "cadence": "once (at install)",
        "uncertaintyBudget": null,
        "status": "in_practice",
        "notes": null
      },
      "specs": {
        "resolution": "4000x3000@25 (12MP)",
        "sensor": "1/1.7\" CMOS",
        "fov": "180° H / 160° V fisheye",
        "low_light_lux": "0.01 color / 0.001 b/w"
      },
      "specSource": "ELDÆON Dionysus spec sheet p2",
      "compute": "platform-pc",
      "recordsMapping": {
        "sensorType": "eo_sensor",
        "detectionMethod": "electro_optical"
      }
    },
    {
      "id": "dionysus-thermal-a",
      "name": "Thermal Camera A",
      "modality": "electro_optical",
      "manufacturerModel": "Uncooled VOx microbolometer",
      "timing": {
        "timeSource": "gps_disciplined",
        "timeUncertaintyNs": null
      },
      "rawData": {
        "format": "MJPEG (radiometric)",
        "locatorPattern": null,
        "sampleRateHz": null,
        "bitDepth": 16
      },
      "measurements": [
        {
          "name": "apparent_temperature",
          "unit": "Cel",
          "uncertainty": {
            "u_c": null,
            "U": null,
            "k": 2,
            "type": "B"
          }
        }
      ],
      "calibration": {
        "calibrated": null,
        "currentMethod": "factory calibration only",
        "traceableReference": "blackbody reference source",
        "referenceInUse": false,
        "cadence": null,
        "uncertaintyBudget": null,
        "status": "candidate_identified",
        "notes": "a practical field reference for thermal cameras is an open question; blackbody source identified as candidate"
      },
      "specs": {
        "resolution": "384x288",
        "detector": "uncooled VOx microbolometer",
        "lens_mm": 19,
        "pixel_pitch_um": 12,
        "netd_mk": "≤50",
        "refresh_hz": 25,
        "spectral_band_um": "7.5-14"
      },
      "specSource": "ELDÆON Dionysus spec sheet p2",
      "compute": "platform-pi",
      "recordsMapping": {
        "sensorType": "flir",
        "detectionMethod": "infrared_flir"
      }
    },
    {
      "id": "dionysus-thermal-b",
      "name": "Thermal Camera B (high-res companion)",
      "modality": "electro_optical",
      "manufacturerModel": "Uncooled VOx microbolometer",
      "timing": {
        "timeSource": "gps_disciplined",
        "timeUncertaintyNs": null
      },
      "rawData": {
        "format": "MJPEG (radiometric)",
        "locatorPattern": null,
        "sampleRateHz": null,
        "bitDepth": 16
      },